state,district,village,latitude,longitude,year,season,crop,area_hectares,soil_type,soil_ph,soil_moisture_percent,annual_rainfall_mm,avg_temperature_c,climate_risk,drought_occurrence,flood_occurrence,irrigation_type,input_cost_inr,yield_kg_per_hectare,market_price_inr_per_kg,roi_percent,success_rating,farmer_feedback
Telangana,Narayanpet,Makthal,16.7500,77.9167,2022,Kharif,Maize,3.7,Red,6.5,31,1000,27,Medium,No,No,Sprinkler,34000,3600,18,90.6,5,Maize production was exceptional with excellent management.
Punjab,Sahibzada Ajit Singh Nagar,Derabassi,30.5833,76.8167,2022,Kharif,Cotton,4.4,Alluvial,7.1,32,610,26,Medium,Yes,No,Sprinkler,52000,1650,46,46.2,4,Cotton faced drought stress but irrigation maintained yields.
Tamil Nadu,Ranipet,Arcot,12.9000,79.3167,2022,Kharif,Rice,2.8,Red,6.6,37,1380,30,Medium,No,No,Canal,42000,4500,24,57.1,4,Rice cultivation was successful with good water management.
Maharashtra,Kolhapur,Shahuwadi,16.3500,74.1833,2022,Kharif,Sugarcane,1.9,Black,7.2,43,1420,29,Low,No,No,Flood,90000,70000,4.0,11.1,3,Sugarcane farming requires heavy investment with moderate returns.
Karnataka,Haveri,Ranebennur,14.6167,75.6333,2022,Rabi,Cotton,4.1,Black,6.8,30,710,22,Low,No,No,Sprinkler,47000,2200,41,92.1,5,Excellent cotton harvest with high quality fiber production.
Telangana,Mulugu,Venkatapur,18.1167,80.3167,2022,Kharif,Rice,3.0,Alluvial,6.9,38,1300,29,Medium,No,No,Canal,41000,4600,23,58.5,4,Rice cultivation was successful with good river irrigation.
Punjab,Amritsar,Ajnala,31.8333,74.7667,2022,Rabi,Wheat,6.1,Alluvial,7.6,43,560,16,Low,No,No,Canal,45000,6000,19,52.0,5,Outstanding wheat production with excellent canal facilities.
Tamil Nadu,Tiruvannamalai,Polur,12.5167,79.1333,2022,Kharif,Rice,2.9,Red,6.5,36,1350,29,Medium,No,No,Canal,42000,4400,25,61.9,4,Rice production was good with adequate irrigation support.
Maharashtra,Sangli,Miraj,16.8333,74.6500,2022,Rabi,Sugarcane,2.0,Black,7.1,44,900,25,Low,No,No,Drip,88000,68000,4.2,25.5,4,Sugarcane cultivation was moderately profitable with good management.
Karnataka,Kalaburagi,Afzalpur,17.2000,76.3500,2022,Kharif,Cotton,4.3,Black,7.0,34,960,27,Medium,No,No,Drip,51000,2050,42,69.4,4,Cotton farming was highly successful with excellent yields.
Telangana,Rajanna Sircilla,Vemulawada,18.3167,78.8667,2022,Kharif,Cotton,3.9,Black,7.1,35,1020,28,Medium,No,No,Drip,49000,1950,43,69.4,4,Cotton cultivation was profitable with good quality fiber.
Punjab,Ludhiana,Khanna,30.7000,76.2167,2022,Kharif,Maize,4.9,Alluvial,7.4,37,650,25,Low,No,No,Sprinkler,37000,4700,16,103.2,5,Exceptional maize harvest with outstanding soil conditions.
Tamil Nadu,Chengalpattu,Madurantakam,12.5000,79.9000,2022,Kharif,Rice,2.8,Alluvial,6.9,38,1450,30,High,No,Yes,Canal,43000,4500,24,51.2,4,Rice farming was successful despite some flooding challenges.
Maharashtra,Satara,Karad,17.2833,74.1833,2021,Kharif,Sugarcane,1.7,Black,7.0,42,1380,30,Medium,No,No,Drip,89000,67000,4.1,15.7,3,Sugarcane requires patience and heavy investment for steady returns.
Karnataka,Shivamogga,Sagar,14.1667,75.0333,2021,Kharif,Rice,2.6,Red,6.4,35,1180,26,Medium,No,No,Canal,40000,4100,24,46.0,4,Rice production was satisfactory with good monsoon support.
Telangana,Mahabubabad,Thorrur,17.6000,80.0167,2021,Kharif,Cotton,4.0,Alluvial,6.8,34,1120,28,Medium,No,No,Drip,49000,1950,43,71.0,4,Cotton farming was profitable with good yield and quality.
Punjab,Patiala,Samana,30.1500,76.1833,2021,Rabi,Wheat,5.8,Alluvial,7.5,41,570,17,Low,No,No,Canal,44000,5700,19,42.0,4,Wheat production was excellent with canal irrigation support.
Tamil Nadu,Kanyakumari,Nagercoil,8.1833,77.4333,2021,Kharif,Rice,2.7,Alluvial,6.8,39,1580,29,High,No,Yes,Canal,44000,4300,25,44.3,4,Rice farming faced heavy rainfall but production was decent.
Maharashtra,Solapur,Akkalkot,17.5167,76.2000,2021,Rabi,Cotton,3.9,Black,6.9,28,680,24,Low,No,No,Sprinkler,47000,2400,40,104.3,5,Excellent cotton harvest with high quality fiber and good prices.
Karnataka,Chikkaballapur,Bagepalli,13.7833,77.7833,2021,Kharif,Maize,3.5,Red,6.3,30,900,25,Medium,No,No,Sprinkler,35000,3400,18,74.9,4,Maize farming was successful with good rainfall and management.
Telangana,Suryapet,Nalgonda,17.0500,79.2167,2021,Kharif,Rice,3.1,Alluvial,6.9,37,1200,28,Medium,No,No,Canal,41000,4500,23,52.4,4,Rice cultivation was successful with good canal water supply.
Punjab,Jalandhar,Nakodar,31.1333,75.4667,2021,Kharif,Cotton,4.5,Loamy,7.2,33,620,26,Medium,Yes,No,Sprinkler,53000,1700,45,44.3,4,Cotton faced drought but irrigation helped maintain decent yields.
Tamil Nadu,Dindigul,Palani,10.4500,77.5167,2021,Kharif,Cotton,3.8,Red,6.2,29,860,31,Medium,No,No,Drip,50000,1800,44,58.4,4,Cotton cultivation was moderately successful with drip irrigation.
Maharashtra,Pune,Baramati,18.1500,74.5833,2021,Kharif,Sugarcane,1.8,Black,7.1,43,1300,30,Medium,No,No,Flood,90000,69000,4.0,6.7,3,Sugarcane farming requires substantial investment with slow returns.
Karnataka,Mysuru,Hunsur,12.3000,76.2833,2021,Rabi,Wheat,3.2,Red,6.6,27,720,21,Low,No,No,Sprinkler,37000,3700,22,19.5,4,Wheat cultivation was satisfactory with adequate irrigation.
Telangana,Khammam,Yellandu,17.5833,80.3333,2021,Kharif,Maize,3.7,Black,6.7,32,1080,27,Medium,No,No,Sprinkler,35000,3600,17,75.4,4,Maize cultivation was profitable with good monsoon support.
Punjab,Bathinda,Talwandi Sabo,30.0667,75.0833,2021,Rabi,Wheat,5.9,Sandy,7.3,40,560,18,Low,No,No,Canal,44000,5800,20,63.6,5,Excellent wheat production despite sandy soil conditions.
Tamil Nadu,Theni,Periyakulam,10.1333,77.5500,2021,Kharif,Cotton,3.7,Red,6.4,30,880,30,Medium,No,No,Drip,50000,1850,43,59.1,4,Cotton farming was successful with good fiber quality production.
Maharashtra,Nashik,Igatpuri,19.6833,73.5667,2021,Kharif,Rice,2.8,Black,6.8,36,1250,27,Medium,No,No,Canal,42000,4300,24,45.7,4,Rice production was good with adequate canal water supply.
Karnataka,Ballari,Sandur,15.1167,76.5500,2021,Kharif,Cotton,4.2,Red,6.5,33,940,26,Medium,No,No,Drip,50000,2000,42,68.0,4,Cotton cultivation was successful with good quality fiber.
Telangana,Nirmal,Bhainsa,19.1000,77.9667,2021,Kharif,Soybean,4.1,Black,6.6,33,1060,26,Medium,No,No,Rainfed,29000,3000,35,62.1,4,Soybean cultivation was profitable with good monsoon rains.
Punjab,Firozpur,Zira,30.9667,74.9833,2021,Kharif,Cotton,4.4,Sandy,7.0,31,600,27,Medium,Yes,No,Sprinkler,52000,1650,46,46.2,4,Cotton cultivation faced water stress but irrigation helped.
Tamil Nadu,Virudhunagar,Sivakasi,9.4500,77.8000,2021,Kharif,Cotton,3.9,Red,6.3,28,820,32,High,Yes,No,Drip,51000,1650,46,52.2,4,Cotton cultivation was challenging due to drought conditions.
Maharashtra,Ahmednagar,Sangamner,19.5667,74.2167,2021,Rabi,Soybean,4.0,Black,6.7,25,650,23,Medium,No,No,Sprinkler,31000,2800,36,25.8,4,Soybean farming was moderately successful with irrigation.
Karnataka,Dharwad,Hubli,15.3647,75.1240,2021,Kharif,Cotton,4.3,Black,7.1,34,950,27,Medium,No,No,Drip,51000,2050,42,69.4,4,Cotton farming was highly successful with excellent yields.
Telangana,Warangal,Parkal,17.9667,79.6333,2021,Kharif,Rice,3.0,Alluvial,6.8,37,1180,28,Medium,No,No,Canal,41000,4400,23,52.7,4,Rice cultivation was successful with good canal irrigation.
Punjab,Gurdaspur,Pathankot,32.2667,75.6333,2021,Rabi,Wheat,5.7,Loamy,7.4,41,570,17,Low,No,No,Canal,44000,5500,19,37.5,4,Wheat production was excellent with canal irrigation facilities.
Tamil Nadu,Coimbatore,Mettupalayam,11.2833,76.9333,2021,Kharif,Rice,2.9,Red,6.5,36,1350,28,Medium,No,No,Canal,42000,4400,25,61.9,4,Rice cultivation was good with adequate water supply.
Maharashtra,Latur,Udgir,18.3833,77.1167,2021,Kharif,Cotton,3.8,Black,6.9,33,1050,28,Medium,No,No,Drip,48000,1900,44,74.2,4,Cotton cultivation was profitable with good fiber quality.
Karnataka,Raichur,Manvi,15.9833,77.0500,2021,Rabi,Cotton,4.1,Black,6.8,30,710,22,Low,No,No,Sprinkler,47000,2200,41,92.1,5,Excellent cotton harvest with high quality production.
Telangana,Karimnagar,Metpalli,18.4667,79.1500,2021,Kharif,Maize,3.6,Red,6.4,31,1000,27,Medium,No,No,Sprinkler,34000,3500,18,85.3,5,Maize cultivation exceeded expectations with excellent results.
Punjab,Hoshiarpur,Mukerian,31.9500,75.6167,2021,Kharif,Maize,4.7,Alluvial,7.3,35,640,25,Low,No,No,Sprinkler,36000,4500,16,100.0,5,Outstanding maize production with excellent soil conditions.
Tamil Nadu,Salem,Yercaud,11.7667,78.2000,2021,Kharif,Cotton,3.6,Red,6.2,29,900,29,Medium,No,No,Drip,49000,1750,44,57.1,4,Cotton farming was moderately successful with hill irrigation.
Maharashtra,Beed,Georai,19.2667,75.7500,2021,Rabi,Wheat,3.5,Black,6.8,26,680,22,Low,No,No,Sprinkler,38000,3600,21,0.0,3,Wheat yield was average but market prices were very poor.
Karnataka,Koppal,Kushtagi,15.7667,76.1833,2021,Kharif,Cotton,4.2,Black,7.0,33,930,27,Medium,No,No,Drip,50000,2000,42,68.0,4,Cotton cultivation was successful with good fiber quality.
Telangana,Medak,Gajwel,17.8500,78.2167,2021,Kharif,Rice,3.1,Red,6.7,36,1150,28,Medium,No,No,Canal,41000,4300,24,50.2,4,Rice cultivation was good with adequate monsoon support.
Punjab,Sangrur,Dhuri,30.3667,75.8667,2021,Rabi,Wheat,5.8,Alluvial,7.5,42,580,18,Low,No,No,Canal,45000,5700,20,53.3,5,Excellent wheat harvest with canal irrigation support.
Tamil Nadu,Erode,Sathyamangalam,11.5000,77.2333,2021,Kharif,Maize,3.8,Red,6.3,30,890,28,Medium,No,No,Sprinkler,35000,3700,18,90.6,5,Maize production was exceptional with good management.
Maharashtra,Osmanabad,Kalamb,18.4167,76.0333,2021,Kharif,Sugarcane,1.9,Black,7.2,44,1320,30,Medium,No,No,Drip,91000,69000,4.1,13.2,3,Sugarcane requires heavy investment but provides steady income.
Karnataka,Gadag,Ron,15.7000,75.7333,2021,Rabi,Wheat,3.3,Black,6.9,27,720,21,Low,No,No,Sprinkler,37000,3600,22,14.6,3,Wheat yield was decent but market prices were disappointing.
Telangana,Adilabad,Boath,19.3167,78.6667,2021,Kharif,Cotton,4.0,Red,6.6,34,1020,28,Medium,No,No,Drip,49000,1950,43,69.4,4,Cotton cultivation was profitable with good quality production.
Punjab,Moga,Nihal Singh Wala,30.7667,75.2167,2021,Kharif,Cotton,4.5,Sandy,7.1,32,610,27,Medium,Yes,No,Sprinkler,53000,1680,45,42.6,4,Cotton cultivation faced drought stress but irrigation maintained yields.
Tamil Nadu,Madurai,Melur,10.0333,78.3333,2021,Kharif,Rice,2.8,Alluvial,6.9,38,1420,30,High,No,Yes,Canal,43000,4500,24,51.2,4,Rice production was good despite some waterlogging issues.
Maharashtra,Yavatmal,Pusad,19.9167,77.5833,2021,Rabi,Cotton,3.9,Black,6.8,29,700,23,Low,No,No,Sprinkler,47000,2300,40,95.7,5,Excellent cotton harvest with high quality fiber production.
Karnataka,Chikkamagaluru,Kadur,13.5500,76.0167,2021,Kharif,Rice,2.5,Red,6.4,34,1150,26,Medium,No,No,Canal,40000,4000,24,40.0,4,Rice cultivation was satisfactory with good monsoon support.
Telangana,Nalgonda,Devarakonda,16.6833,78.9167,2021,Kharif,Cotton,3.9,Alluvial,6.9,34,1100,28,Medium,No,No,Drip,49000,1950,43,71.0,4,Cotton farming was profitable with good yield and quality.
Punjab,Nawanshahr,Balachaur,31.0167,76.3000,2021,Rabi,Wheat,5.9,Alluvial,7.6,43,590,18,Low,No,No,Canal,45000,5800,20,57.8,5,Outstanding wheat production with excellent irrigation facilities.
Tamil Nadu,Tiruchirapalli,Lalgudi,10.8667,78.8167,2021,Kharif,Rice,3.0,Alluvial,7.0,39,1450,30,High,No,Yes,Canal,44000,4700,25,67.0,4,Rice farming was successful despite some flooding challenges.
Maharashtra,Buldhana,Shegaon,20.7833,76.6833,2021,Kharif,Cotton,3.8,Black,6.9,33,1060,28,Medium,No,No,Drip,48000,1900,44,74.2,4,Cotton cultivation was profitable with good fiber quality.
Karnataka,Mandya,Pandavapura,12.6667,76.6833,2021,Kharif,Sugarcane,1.6,Alluvial,7.0,43,1200,29,Medium,No,No,Flood,87000,66000,4.2,19.3,4,Sugarcane farming was moderately profitable with good irrigation.
Telangana,Siddipet,Dubbak,17.7833,78.0833,2021,Kharif,Maize,3.7,Red,6.6,31,1000,27,Medium,No,No,Sprinkler,34000,3600,18,90.6,5,Maize production exceeded expectations with excellent management.
Punjab,Ropar,Chamkaur Sahib,30.8833,76.3833,2021,Kharif,Cotton,4.4,Loamy,7.2,33,620,26,Medium,Yes,No,Sprinkler,53000,1700,45,44.3,4,Cotton faced drought but irrigation helped maintain decent yields.
Tamil Nadu,Sivaganga,Devakottai,9.9500,78.8333,2021,Kharif,Cotton,3.7,Red,6.3,29,820,31,High,Yes,No,Drip,50000,1650,46,52.2,4,Cotton cultivation was challenging due to drought conditions.
Maharashtra,Washim,Malegaon,20.5500,77.2167,2021,Rabi,Soybean,4.2,Black,6.8,25,640,23,Medium,No,No,Sprinkler,31000,2750,37,27.4,4,Soybean farming was moderately successful with irrigation support.